{
  "callback_id": "CB-4a7d9e2f-1b3c-4d8e-9f60-5a2b7c1e3d94",
  "customer_id": "CUST-DEMO-RAVI",
  "role": "hardship_officer",
  "slot_start": "2026-10-12T05:30:00Z",
  "slot_end": "2026-10-12T06:00:00Z",
  "summary": "Customer reports job loss and is the sole earner for his family; cannot pay any amount now. Card has job-loss insurance cover: check claim. Explain options and agree a review date.",
  "created_at": "2026-10-11T10:10:00Z"
}
